{
  "$schema": "http://json-schema.org/draft-07/schema#",
  "type": "array",
  "items": {
    "type": "object",
    "properties": {
      "roundNumber": {
        "type": "integer",
        "minimum": 1,
        "maximum": 9007199254740991
      },
      "tick": {
        "type": "integer",
        "minimum": 1,
        "maximum": 9007199254740991
      },
      "clutcherIndex": {
        "type": "integer",
        "minimum": 0,
        "maximum": 9007199254740991
      },
      "opponentCount": {
        "type": "integer",
        "minimum": 1,
        "maximum": 5
      },
      "won": {
        "type": "boolean"
      },
      "survived": {
        "type": "boolean"
      },
      "killCount": {
        "type": "integer",
        "minimum": 0,
        "maximum": 5
      }
    },
    "required": [
      "roundNumber",
      "tick",
      "clutcherIndex",
      "opponentCount",
      "won",
      "survived",
      "killCount"
    ],
    "additionalProperties": false
  }
}
