[{"roundNumber":1,"tick":7578,"clutcherIndex":2,"opponentCount":2,"won":true,"survived":true,"killCount":2},{"roundNumber":1,"tick":7716,"clutcherIndex":8,"opponentCount":1,"won":false,"survived":true,"killCount":0},{"roundNumber":2,"tick":13227,"clutcherIndex":6,"opponentCount":4,"won":false,"survived":true,"killCount":0},{"roundNumber":3,"tick":21143,"clutcherIndex":8,"opponentCount":2,"won":false,"survived":true,"killCount":0},{"roundNumber":4,"tick":27291,"clutcherIndex":0,"opponentCount":2,"won":true,"survived":true,"killCount":2},{"roundNumber":4,"tick":30078,"clutcherIndex":9,"opponentCount":1,"won":false,"survived":true,"killCount":0},{"roundNumber":5,"tick":38625,"clutcherIndex":2,"opponentCount":2,"won":false,"survived":true,"killCount":0},{"roundNumber":6,"tick":45722,"clutcherIndex":4,"opponentCount":3,"won":false,"survived":true,"killCount":1},{"roundNumber":7,"tick":53349,"clutcherIndex":0,"opponentCount":4,"won":false,"survived":true,"killCount":2},{"roundNumber":8,"tick":63622,"clutcherIndex":4,"opponentCount":3,"won":false,"survived":true,"killCount":0},{"roundNumber":9,"tick":72265,"clutcherIndex":0,"opponentCount":4,"won":false,"survived":true,"killCount":1},{"roundNumber":10,"tick":77808,"clutcherIndex":3,"opponentCount":5,"won":false,"survived":true,"killCount":0},{"roundNumber":11,"tick":85106,"clutcherIndex":6,"opponentCount":3,"won":false,"survived":true,"killCount":0},{"roundNumber":12,"tick":94074,"clutcherIndex":6,"opponentCount":2,"won":false,"survived":true,"killCount":0},{"roundNumber":13,"tick":102406,"clutcherIndex":9,"opponentCount":5,"won":false,"survived":true,"killCount":2},{"roundNumber":14,"tick":109882,"clutcherIndex":9,"opponentCount":5,"won":false,"survived":true,"killCount":0},{"roundNumber":15,"tick":116437,"clutcherIndex":1,"opponentCount":2,"won":false,"survived":true,"killCount":0},{"roundNumber":16,"tick":123258,"clutcherIndex":9,"opponentCount":3,"won":false,"survived":true,"killCount":0},{"roundNumber":17,"tick":126460,"clutcherIndex":9,"opponentCount":4,"won":false,"survived":true,"killCount":0},{"roundNumber":18,"tick":131196,"clutcherIndex":6,"opponentCount":4,"won":false,"survived":true,"killCount":0},{"roundNumber":19,"tick":137765,"clutcherIndex":7,"opponentCount":4,"won":false,"survived":true,"killCount":1},{"roundNumber":20,"tick":146482,"clutcherIndex":4,"opponentCount":3,"won":false,"survived":true,"killCount":1},{"roundNumber":21,"tick":152982,"clutcherIndex":8,"opponentCount":4,"won":false,"survived":true,"killCount":1}]